{
  "version": "1.0",
  "style_playbook": "kj-esg-pixar-hybrid",
  "entities": [
    {
      "id": "char_amy",
      "type": "character",
      "name": "Amy（ESG 推廣專員）",
      "description": "Pixar-style 3D young Taiwanese office woman; wavy chin-length brown bob with side-swept bangs, large expressive green eyes, light freckles; wearing a heather-grey fitted blazer with rolled/cuffed sleeves, slim tailored trousers, cream open-collar silk blouse, dark-brown low pumps; highly animated expressions ranging from anxious overload to radiant epiphany, energetic Vlogger persona.",
      "reference_images": [
        "clp/char_amy.jpeg"
      ],
      "source": "imported",
      "appears_in": [
        "shot_1.1.12",
        "shot_1.2.1",
        "shot_1.2.2",
        "shot_1.2.3",
        "shot_1.2.4",
        "shot_1.2.5",
        "shot_1.2.6",
        "shot_1.2.7",
        "shot_1.2.8",
        "shot_1.2.9",
        "shot_1.3.1",
        "shot_2.1.1",
        "shot_2.1.2",
        "shot_2.1.4",
        "shot_2.1.7",
        "shot_2.1.9",
        "shot_2.1.12",
        "shot_2.1.13",
        "shot_2.1.16",
        "shot_2.1.18",
        "shot_2.1.19",
        "shot_2.1.20",
        "shot_2.1.23",
        "shot_2.1.26",
        "shot_2.1.27",
        "shot_2.1.29",
        "shot_2.2.1",
        "shot_2.2.2",
        "shot_2.2.3",
        "shot_2.2.7",
        "shot_2.4.1",
        "shot_2.5.1",
        "shot_2.5.2",
        "shot_2.5.3",
        "shot_2.5.4",
        "shot_2.7.1",
        "shot_2.7.4",
        "shot_2.7.7",
        "shot_2.7.10",
        "shot_2.7.12",
        "shot_2.8.2",
        "shot_2.8.4",
        "shot_2.8.6",
        "shot_3.1.1",
        "shot_3.1.2",
        "shot_3.1.3",
        "shot_3.2.5",
        "shot_3.3.2",
        "shot_3.3.3",
        "shot_3.3.10",
        "shot_3.4.5",
        "shot_3.6.2",
        "shot_3.7.1",
        "shot_3.7.2",
        "shot_3.7.3",
        "shot_3.7.4",
        "shot_3.7.5",
        "shot_3.7.6",
        "shot_3.7.7",
        "shot_3.7.8",
        "shot_3.8.1",
        "shot_3.8.3",
        "shot_3.8.5",
        "shot_3.8.7",
        "shot_3.8.8",
        "shot_3.8.9",
        "shot_3.8.11",
        "shot_3.8.14",
        "shot_3.8.16",
        "shot_3.8.17",
        "shot_3.9.1",
        "shot_3.9.2",
        "shot_3.9.3",
        "shot_3.9.4",
        "shot_3.9.5",
        "shot_3.9.6",
        "shot_3.9.7",
        "shot_4.1.1",
        "shot_4.1.2",
        "shot_4.1.3",
        "shot_4.2.1",
        "shot_4.2.3",
        "shot_4.2.4",
        "shot_4.2.6",
        "shot_4.3.1",
        "shot_4.3.2",
        "shot_4.3.4",
        "shot_4.3.6",
        "shot_4.4.1",
        "shot_4.4.2",
        "shot_4.4.4",
        "shot_4.4.6",
        "shot_4.4.7",
        "shot_4.4.9",
        "shot_4.5.1",
        "shot_4.5.2",
        "shot_4.5.5",
        "shot_4.5.7",
        "shot_4.6.1",
        "shot_4.6.2",
        "shot_4.6.3",
        "shot_4.6.5",
        "shot_4.6.7",
        "shot_4.6.9",
        "shot_4.6.10",
        "shot_4.7.1",
        "shot_4.7.2",
        "shot_4.7.3",
        "shot_5.1.1",
        "shot_5.1.2a",
        "shot_5.1.2b",
        "shot_5.1.3",
        "shot_5.2.3"
      ],
      "notes": "全劇女主角，從苦惱的政策執行者轉變為充滿活力的 ESG 尋寶獵人。"
    },
    {
      "id": "char_george",
      "type": "character",
      "name": "George（資深企業永續顧問）",
      "description": "Pixar-style 3D older male character; swept-back silver-grey hair; thick grey eyebrows; hazel eyes; a prominent nose; visible facial lines; short white moustache and beard stubble; dark brown square-framed glasses; textured brown buttoned waistcoat; cream collared shirt with rolled sleeves; dark brown tie; dark brown trousers; brown lace-up shoes; wristwatch on his left wrist.",
      "reference_images": [
        "clp/char_george.png"
      ],
      "source": "imported",
      "appears_in": [
        "shot_2.1.1",
        "shot_2.1.3",
        "shot_2.1.5",
        "shot_2.1.6",
        "shot_2.1.8",
        "shot_2.1.10",
        "shot_2.1.11",
        "shot_2.1.14",
        "shot_2.1.15",
        "shot_2.1.17",
        "shot_2.1.22",
        "shot_2.1.24",
        "shot_2.1.25",
        "shot_2.1.28",
        "shot_2.1.29",
        "shot_2.1.30",
        "shot_2.2.1",
        "shot_2.2.4",
        "shot_2.2.5",
        "shot_2.2.6",
        "shot_2.3.1",
        "shot_2.3.2",
        "shot_2.3.3",
        "shot_2.3.4",
        "shot_2.3.5",
        "shot_2.3.6",
        "shot_2.3.7",
        "shot_2.3.8",
        "shot_2.4.2",
        "shot_2.4.3",
        "shot_2.4.4",
        "shot_2.4.5",
        "shot_2.4.6",
        "shot_2.4.7",
        "shot_2.5.1",
        "shot_2.5.4",
        "shot_2.5.7",
        "shot_2.5.8",
        "shot_2.5.9",
        "shot_2.6.1",
        "shot_2.7.2",
        "shot_2.7.3",
        "shot_2.7.5",
        "shot_2.7.6",
        "shot_2.7.8",
        "shot_2.7.9",
        "shot_2.7.11",
        "shot_2.7.13",
        "shot_3.1.1",
        "shot_3.1.3",
        "shot_3.1.4",
        "shot_3.2.1",
        "shot_3.2.2",
        "shot_3.2.3",
        "shot_3.2.4",
        "shot_3.2.5",
        "shot_3.2.6",
        "shot_3.3.1",
        "shot_3.3.2",
        "shot_3.3.4",
        "shot_3.3.5",
        "shot_3.3.6",
        "shot_3.3.7",
        "shot_3.3.8",
        "shot_3.3.9",
        "shot_3.4.1",
        "shot_3.4.2",
        "shot_3.4.3",
        "shot_3.4.4",
        "shot_3.5.1",
        "shot_3.5.2",
        "shot_3.5.3",
        "shot_3.6.1",
        "shot_3.6.2",
        "shot_3.7.2",
        "shot_3.7.7",
        "shot_3.8.1",
        "shot_3.8.2",
        "shot_3.8.3",
        "shot_3.8.4",
        "shot_3.8.5",
        "shot_3.8.6",
        "shot_3.8.7",
        "shot_3.8.8",
        "shot_3.8.9",
        "shot_3.8.10",
        "shot_3.8.11",
        "shot_3.8.12",
        "shot_3.8.13",
        "shot_3.8.14",
        "shot_3.8.15",
        "shot_3.8.16",
        "shot_3.8.17",
        "shot_3.9.3",
        "shot_4.3.4"
      ],
      "notes": "Amy 的良師益友，在咖啡館與公園以健身教練等通俗比喻指引 ESG 核心邏輯。"
    },
    {
      "id": "char_supervisor",
      "type": "character",
      "name": "主管（大成科技行政協理）",
      "description": "Pixar-style 3D middle-aged East-Asian corporate manager; disheveled short black thinning hair, worried furrowed brows, prominent round nose, faint stubble; wearing a pale-blue dress shirt with rolled-up sleeves, loosened diagonal-striped brown silk tie, dark brown trousers, polished belt; hyper-expressive, comedic stress posture, easily excitable.",
      "reference_images": [
        "clp/char_supervisor.jpeg"
      ],
      "source": "imported",
      "appears_in": [
        "shot_1.2.1",
        "shot_1.2.2",
        "shot_1.2.3",
        "shot_1.2.5",
        "shot_1.2.7",
        "shot_1.3.1",
        "shot_2.7.13",
        "shot_2.8.1",
        "shot_2.8.2",
        "shot_2.8.3",
        "shot_2.8.4",
        "shot_2.8.5",
        "shot_2.8.6",
        "shot_3.7.1",
        "shot_3.7.2",
        "shot_3.7.3",
        "shot_3.7.4",
        "shot_3.7.5",
        "shot_3.7.6",
        "shot_3.7.7",
        "shot_3.7.8",
        "shot_3.8.5"
      ],
      "notes": "面臨增資案卡關的咆哮主管，典型業績導向但講求情理的管理階層。"
    },
    {
      "id": "char_harrison",
      "type": "character",
      "name": "Mr. Harrison（倫敦跨國基金資深合夥人）",
      "description": "Pixar-style 3D older British senior executive; impeccably slicked-back platinum-silver hair, sharp bushy dark grey brows, aristocratic hawkish nose, piercing steel-blue eyes with disciplined stern gaze; wearing an immaculate bespoke navy pinstripe three-piece suit, crisp white stiff-collar shirt, silk regimental tie; commanding aristocratic presence.",
      "reference_images": [
        "clp/char_harrison.jpeg"
      ],
      "source": "imported",
      "appears_in": [
        "shot_1.1.2",
        "shot_1.1.3",
        "shot_1.1.4",
        "shot_1.1.7",
        "shot_1.1.8",
        "shot_1.1.10",
        "shot_5.2.1",
        "shot_5.2.3",
        "shot_5.2.4",
        "shot_5.2.5",
        "shot_5.2.6",
        "shot_5.2.7"
      ],
      "notes": "第一幕冷酷否決『Risk is not attractive』，第五幕被真實數據與全員承諾打動批准投資。"
    },
    {
      "id": "char_sandy",
      "type": "character",
      "name": "Sandy（海外投資機構審查分析師）",
      "description": "Pixar-style 3D young professional woman analyst; brunette hair neatly gathered into a professional low chignon with side-parted fringe, smart black modern rectangular glasses, keen blue-grey eyes; fitted black sharp pantsuit, silk off-white blouse, blue institutional lanyard with magnetic security badge, modest silver stud earrings; crisp and articulate.",
      "reference_images": [
        "clp/char_sandy.jpeg"
      ],
      "source": "imported",
      "appears_in": [
        "shot_1.1.2",
        "shot_1.1.3",
        "shot_1.1.5",
        "shot_1.1.6",
        "shot_1.1.9",
        "shot_5.2.1",
        "shot_5.2.2"
      ],
      "notes": "倫敦會議室負責向哈里森先生報告大成科技案件的專業審查員。"
    },
    {
      "id": "char_analyst2",
      "type": "character",
      "name": "Analyst 2（海外投資機構年輕男審查員）",
      "description": "Pixar-style 3D young male investment analyst; wavy medium-brown hair, thick expressive eyebrows, warm brown eyes, clean-shaven; wearing a crisp white button-down dress shirt with sleeves rolled to the elbows, tailored dark navy trousers, dark-brown leather dress shoes; attentive institutional posture.",
      "reference_images": [
        "clp/char_analyst2.jpg"
      ],
      "source": "imported",
      "appears_in": [
        "shot_1.1.2",
        "shot_1.1.4",
        "shot_5.2.1",
        "shot_5.2.3",
        "shot_5.2.6"
      ],
      "notes": "倫敦會議室哈里森左側的年輕男審查員，負責操作簡報與旁聽審查（見 cam_harrison_ots_analyst2）。"
    },
    {
      "id": "char_chen",
      "type": "character",
      "name": "小陳（研發部研發工程師）",